{
  "$schema": "http://json-schema.org/draft-07/schema#",
  "title": "AI7 Provider Processing Policy v8",
  "description": "Validates the exact developer-live Provider Processing v8 authority contract: the v7 analysis rule byte for byte (the AI7 platform tools of ADR 0080 §7.5) beside the one Interactive Editorial Dialogue rule of ADR 0088 §1, and nothing else.",
  "type": "object",
  "additionalProperties": false,
  "required": [
    "schemaDialect",
    "schemaPath",
    "documentType",
    "policyId",
    "policyType",
    "version",
    "lifecycleStatus",
    "predecessorVersion",
    "predecessorCanonicalPath",
    "canonicalPath",
    "humanProjectionPath",
    "operationalScope",
    "authorityBasis",
    "trustedSelection",
    "decision",
    "outboundDataCategories",
    "credentialBoundary",
    "authoritySeparations"
  ],
  "properties": {
    "schemaDialect": {
      "const": "http://json-schema.org/draft-07/schema#"
    },
    "schemaPath": {
      "const": "docs/policies/provider-processing-policy.v8.schema.json"
    },
    "documentType": {
      "const": "ai7-policy-document"
    },
    "policyId": {
      "const": "provider-processing-policy"
    },
    "policyType": {
      "const": "provider-processing"
    },
    "version": {
      "const": "v8"
    },
    "lifecycleStatus": {
      "const": "active"
    },
    "predecessorVersion": {
      "const": "v7"
    },
    "predecessorCanonicalPath": {
      "const": "docs/policies/provider-processing-policy.v7.json"
    },
    "canonicalPath": {
      "const": "docs/policies/provider-processing-policy.v8.json"
    },
    "humanProjectionPath": {
      "const": "docs/policies/provider-processing-policy.v8.md"
    },
    "operationalScope": {
      "const": "developer-live"
    },
    "authorityBasis": {
      "const": [
        "docs/domain/execution/CONTEXT.md",
        "docs/adr/0007-separate-decisions-authority-and-effect-proof.md",
        "docs/adr/0016-proprietary-license-and-local-only-sample-manuscripts.md",
        "docs/adr/0043-allow-public-samplebooks-in-repository-and-ci.md",
        "docs/adr/0046-separate-provider-processing-by-operational-scope.md",
        "docs/adr/0065-admit-a-developer-live-provider-processing-scope.md",
        "docs/adr/0066-add-model-driven-cross-unit-reduction-and-assurance-sampling.md",
        "docs/adr/0067-authorize-the-opencode-go-development-credential-with-live-once-testing.md",
        "docs/adr/0070-run-developer-live-unattended-and-size-the-ceiling-per-unit.md",
        "docs/adr/0079-record-the-owner-s-decisions-of-2026-09-10-on-storage-policies-export-egress-providers-and-samplebooks.md",
        "docs/adr/0080-assign-a-provider-route-and-model-to-every-task-that-transmits.md",
        "docs/adr/0088-carry-the-editorial-dialogue-under-developer-live.md",
        "docs/architecture-v2/HARNESS-INTEGRATION.md"
      ]
    },
    "trustedSelection": {
      "const": {
        "selectionAuthorityClass": "trusted-build-or-launch-authority",
        "launchArgument": "--trusted-operational-scope developer-live",
        "developerHostOnly": true,
        "hostedOrCiSelectionAllowed": false,
        "ordinaryProductSettingAllowed": false,
        "environmentVariableSelectorAllowed": false,
        "providerSelectorAllowed": false,
        "artifactOrPluginSelectorAllowed": false,
        "crossScopeFallbackAllowed": false,
        "selectionConfiguresProvider": false,
        "selectionDispatchesRun": false
      }
    },
    "decision": {
      "type": "object",
      "additionalProperties": false,
      "required": [
        "default",
        "providerAllowRules"
      ],
      "properties": {
        "default": {
          "const": "deny"
        },
        "providerAllowRules": {
          "type": "array",
          "minItems": 2,
          "maxItems": 2,
          "additionalItems": false,
          "items": [
            {
              "$ref": "#/definitions/developerLiveRule"
            },
            {
              "$ref": "#/definitions/developerLiveDialogueRule"
            }
          ]
        }
      }
    },
    "outboundDataCategories": {
      "const": {
        "public-or-synthetic": {
          "labelZh": "公开或合成内容"
        },
        "unpublished-metadata": {
          "labelZh": "未公开材料元数据"
        },
        "unpublished-excerpts": {
          "labelZh": "未公开材料选段"
        },
        "unpublished-full-content": {
          "labelZh": "未公开材料全文"
        },
        "editor-selected-manuscript-excerpt": {
          "labelZh": "编辑所选稿件选段"
        }
      }
    },
    "credentialBoundary": {
      "const": {
        "isOutboundDataCategory": false,
        "permittedInModelVisibleMaterial": false,
        "permittedInGeneralOutboundMaterial": false,
        "opaqueReferenceOnlyOutsideFinalConsumer": true,
        "credentialBrokerResolutionRequired": true,
        "finalAdapterOnly": true,
        "protectedSecretStoreOnly": true,
        "enrollmentHelperIsOnlyKeyFileReader": true,
        "policyEligibilityConfiguresCredential": false
      }
    },
    "authoritySeparations": {
      "const": {
        "policyEligibilityDispatchesProviderCall": false,
        "policyEligibilityCreatesProviderImplementation": false,
        "runSourceScopeAloneAuthorizesTransmission": false,
        "runAuthorizationAloneOverridesThisPolicy": false,
        "configuredProviderAloneAuthorizesTransmission": false,
        "providerSetupAloneAuthorizesTransmission": false,
        "configuredCredentialAloneAuthorizesTransmission": false,
        "artifactInstallOrEnablementAuthorizesTransmission": false,
        "dshSessionOrPluginMembershipAuthorizesTransmission": false,
        "defaultExecutionRuleWithoutUserInitiatedTaskAuthorizesTransmission": false,
        "backgroundAnalysisEnrollmentAuthorizesTransmission": false,
        "externalExportPolicyAuthorizesProviderTransmission": false,
        "effectApprovalAuthorizesProviderTransmission": false,
        "providerResultCacheIsRecordedDeterministicModelFixture": false,
        "providerResultCacheProvesProviderConformance": false,
        "providerProcessingAuthorizesManuscriptApply": false,
        "providerProcessingAuthorizesLearning": false,
        "providerProcessingAuthorizesPublication": false,
        "providerProcessingGrantsPublicReleasePermission": false
      }
    }
  },
  "definitions": {
    "developerLiveRule": {
      "type": "object",
      "additionalProperties": false,
      "required": [
        "ruleId",
        "policyResult",
        "purpose",
        "authorityOrigin",
        "executionMode",
        "source",
        "allowedOutboundDataCategories",
        "redaction",
        "providerBinding",
        "transmissions",
        "platformTools",
        "authorizationPreconditions",
        "providerAccountLimit",
        "capture",
        "additionalPrivacyPrompts"
      ],
      "properties": {
        "ruleId": {
          "const": "developer-live-public-samplebook-analysis"
        },
        "policyResult": {
          "const": "eligible-only"
        },
        "purpose": {
          "const": "developer-live-prompt-and-pipeline-tuning"
        },
        "authorityOrigin": {
          "const": {
            "newlyUserInitiatedTaskRequired": true,
            "directRunAuthorizationAllowed": true,
            "matchingActiveDefaultExecutionRuleAllowed": false,
            "backgroundAnalysisEnrollmentAllowed": false,
            "idleScheduledImportTriggeredOrCrossRunDispatchAllowed": false
          }
        },
        "executionMode": {
          "const": {
            "humanAttended": true,
            "developerHostOnly": true,
            "ciAllowed": false,
            "hostedAllowed": false,
            "scheduledAllowed": false,
            "backgroundAllowed": false
          }
        },
        "source": {
          "const": {
            "admittedInputs": "owner-designated-public-samplebooks-under-adr-0043",
            "transmittableSetFixedByImplementingSlice": true,
            "privateManuscriptAllowed": false,
            "otherBookRefusedBeforeDispatch": true
          }
        },
        "allowedOutboundDataCategories": {
          "const": [
            "public-or-synthetic"
          ]
        },
        "redaction": {
          "const": {
            "housePeopleNamesAndRolesStripped": true,
            "remarksAndInternalNotesStripped": true,
            "authorInformationAllowed": true,
            "houseNameAllowed": true
          }
        },
        "providerBinding": {
          "const": {
            "modelRole": "Main Editorial Role",
            "route": "opencode-go",
            "endpoint": "https://opencode.ai/zen/go/v1/chat/completions",
            "model": "deepseek-v4-flash",
            "credentialSlot": "opencode-go",
            "exactProviderBindingRequired": true,
            "fallbackAllowed": false,
            "approvedFallbackChainMaximumItems": 0,
            "secondModelAllowed": false,
            "productionDefaultsChanged": false
          }
        },
        "transmissions": {
          "const": {
            "boundedByCoverageManifestUnitCount": true,
            "plusDeclaredSafeRetryAdaptations": true,
            "plusCrossUnitReductionTopicSections": true,
            "plusAssuranceSampleAnchorUnits": true,
            "plusOneRunReportReflectionTurn": true,
            "oneTechnicalSessionPerAnalysisUnit": true,
            "accumulatingSingleSessionAllowed": false,
            "identicalRequestReplaysFromProviderResultCache": true,
            "repeatedTestItemIdentifierAllowed": false,
            "crossUnitReductionAllowed": true,
            "assuranceSamplingAllowed": true,
            "runReportReflectionAllowed": true,
            "webSearchToolAllowed": true
          }
        },
        "platformTools": {
          "const": {
            "websearch": {
              "service": "parallel",
              "host": "search.parallel.ai",
              "tool": "web_search",
              "anonymous": true
            },
            "webfetch": {
              "maxBytes": 5242880,
              "timeoutSeconds": 30,
              "boundedByCitations": true
            }
          }
        },
        "authorizationPreconditions": {
          "const": {
            "eligibleConfiguredProviderRequired": true,
            "providerPreflightRequired": true,
            "exactProviderBindingRequired": true,
            "planEnvelopeRequired": true,
            "runAuthorizationRequired": true,
            "runSourceScopeRequired": true,
            "declaredOperationClassesRequired": true,
            "exactRunBudgetCeilingStateRequired": true,
            "unsetRunBudgetCeilingAllowed": false,
            "defaultRunBudgetCeilingTokensPerFrozenUnit": 90000,
            "defaultRunBudgetCeilingComputedAfterCoverageManifestFreeze": true,
            "ceilingEvaluatedBeforeEveryDispatch": true,
            "finalProviderPayloadEgressGateRequired": true,
            "frozenBeforeTransmission": true
          }
        },
        "providerAccountLimit": {
          "const": {
            "classification": "quota-exhausted",
            "endsRunAsProviderAccountLimit": true,
            "retryAllowed": false,
            "fallbackAllowed": false,
            "secondModelAllowed": false
          }
        },
        "capture": {
          "const": {
            "fixtureEmissionAllowed": false,
            "uploadAllowed": false,
            "providerResultCacheAllowed": true,
            "cacheLocation": "protected-local-staging-outside-every-checkout",
            "rawBytesInLogsDiagnosticsOrRepositoryAllowed": false,
            "repositoryEntryOnlyThroughReviewedFixtureGeneration": true
          }
        },
        "additionalPrivacyPrompts": {
          "const": {
            "perBookRequired": false,
            "firstUseRequired": false,
            "perCallRequired": false,
            "perChunkRequired": false
          }
        }
      }
    },
    "developerLiveDialogueRule": {
      "type": "object",
      "additionalProperties": false,
      "required": [
        "ruleId",
        "policyResult",
        "purpose",
        "authorityOrigin",
        "executionMode",
        "source",
        "allowedOutboundDataCategories",
        "redaction",
        "providerBinding",
        "transmissions",
        "authorizationPreconditions",
        "providerAccountLimit",
        "capture",
        "additionalPrivacyPrompts"
      ],
      "properties": {
        "ruleId": {
          "const": "developer-live-editor-selected-excerpt-dialogue"
        },
        "policyResult": {
          "const": "eligible-only"
        },
        "purpose": {
          "const": "developer-live-interactive-editorial-dialogue"
        },
        "authorityOrigin": {
          "const": {
            "editorStartedForegroundAttemptRequired": true,
            "exactSelectionAndQuestionAreTheAuthority": true,
            "newlyUserInitiatedTaskRequired": false,
            "directRunAuthorizationRequired": false,
            "matchingActiveDefaultExecutionRuleAllowed": false,
            "backgroundAnalysisEnrollmentAllowed": false,
            "idleScheduledImportTriggeredOrCrossRunDispatchAllowed": false
          }
        },
        "executionMode": {
          "const": {
            "humanAttended": true,
            "developerHostOnly": true,
            "ciAllowed": false,
            "hostedAllowed": false,
            "scheduledAllowed": false,
            "backgroundAllowed": false
          }
        },
        "source": {
          "const": {
            "admittedInputs": "owner-designated-public-samplebooks-under-adr-0043",
            "transmittableSetFixedByImplementingSlice": true,
            "editedRevisionsOfAdmittedBookAllowed": true,
            "privateManuscriptAllowed": false,
            "otherBookRefusedBeforeDispatch": true
          }
        },
        "allowedOutboundDataCategories": {
          "const": [
            "editor-selected-manuscript-excerpt"
          ]
        },
        "redaction": {
          "const": {
            "housePeopleNamesAndRolesStripped": true,
            "remarksAndInternalNotesStripped": true,
            "authorInformationAllowed": true,
            "houseNameAllowed": true
          }
        },
        "providerBinding": {
          "const": {
            "modelRole": "Main Editorial Role",
            "route": "opencode-go",
            "endpoint": "https://opencode.ai/zen/go/v1/chat/completions",
            "model": "deepseek-v4-flash",
            "credentialSlot": "opencode-go",
            "exactProviderBindingRequired": true,
            "fallbackAllowed": false,
            "approvedFallbackChainMaximumItems": 0,
            "secondModelAllowed": false,
            "productionDefaultsChanged": false
          }
        },
        "transmissions": {
          "const": {
            "attemptKinds": [
              "ask",
              "continue",
              "regenerate"
            ],
            "oneTransmissionPerAttempt": true,
            "oneTechnicalSessionPerAttempt": true,
            "retryResendOrContinuationWithinSessionAllowed": false,
            "continueAndRegenerateAreNewAttempts": true,
            "payload": [
              "frozen-editorial-dialogue-contract-header",
              "exact-selected-words",
              "question",
              "complete-kept-fragments-on-continue"
            ],
            "identicalRequestReplaysFromProviderResultCache": true,
            "repeatedTestItemIdentifierAllowed": false,
            "webSearchToolAllowed": false
          }
        },
        "authorizationPreconditions": {
          "const": {
            "eligibleConfiguredProviderRequired": true,
            "providerPreflightRequired": true,
            "exactProviderBindingRequired": true,
            "planEnvelopeRequired": false,
            "runAuthorizationRequired": false,
            "runBudgetCeilingApplies": false,
            "costBound": "one-bounded-payload-per-attempt",
            "perAttemptOutputCapTokens": null,
            "finalProviderPayloadEgressGateRequired": true,
            "frozenBeforeTransmission": true
          }
        },
        "providerAccountLimit": {
          "const": {
            "classification": "quota-exhausted",
            "endsAttemptAsProviderAccountLimit": true,
            "retryAllowed": false,
            "fallbackAllowed": false,
            "secondModelAllowed": false
          }
        },
        "capture": {
          "const": {
            "fixtureEmissionAllowed": false,
            "uploadAllowed": false,
            "providerResultCacheAllowed": true,
            "cacheLocation": "protected-local-staging-outside-every-checkout",
            "harnessSessionLedgerUnderAgentDataRootIsTheOnlyPersistence": true,
            "ai7RelationLogOrDiagnosticHoldsQuestionOrAnswer": false,
            "rawBytesInLogsDiagnosticsOrRepositoryAllowed": false,
            "repositoryEntryOnlyThroughReviewedFixtureGeneration": true
          }
        },
        "additionalPrivacyPrompts": {
          "const": {
            "perBookRequired": false,
            "firstUseRequired": false,
            "perCallRequired": false,
            "perChunkRequired": false
          }
        }
      }
    }
  }
}
