{
  "schemaDialect": "http://json-schema.org/draft-07/schema#",
  "schemaPath": "docs/policies/provider-processing-policy.v8.schema.json",
  "documentType": "ai7-policy-document",
  "policyId": "provider-processing-policy",
  "policyType": "provider-processing",
  "version": "v8",
  "lifecycleStatus": "active",
  "predecessorVersion": "v7",
  "predecessorCanonicalPath": "docs/policies/provider-processing-policy.v7.json",
  "canonicalPath": "docs/policies/provider-processing-policy.v8.json",
  "humanProjectionPath": "docs/policies/provider-processing-policy.v8.md",
  "operationalScope": "developer-live",
  "authorityBasis": [
    "docs/domain/execution/CONTEXT.md",
    "docs/adr/0007-separate-decisions-authority-and-effect-proof.md",
    "docs/adr/0016-proprietary-license-and-local-only-sample-manuscripts.md",
    "docs/adr/0043-allow-public-samplebooks-in-repository-and-ci.md",
    "docs/adr/0046-separate-provider-processing-by-operational-scope.md",
    "docs/adr/0065-admit-a-developer-live-provider-processing-scope.md",
    "docs/adr/0066-add-model-driven-cross-unit-reduction-and-assurance-sampling.md",
    "docs/adr/0067-authorize-the-opencode-go-development-credential-with-live-once-testing.md",
    "docs/adr/0070-run-developer-live-unattended-and-size-the-ceiling-per-unit.md",
    "docs/adr/0079-record-the-owner-s-decisions-of-2026-09-10-on-storage-policies-export-egress-providers-and-samplebooks.md",
    "docs/adr/0080-assign-a-provider-route-and-model-to-every-task-that-transmits.md",
    "docs/adr/0088-carry-the-editorial-dialogue-under-developer-live.md",
    "docs/architecture-v2/HARNESS-INTEGRATION.md"
  ],
  "trustedSelection": {
    "selectionAuthorityClass": "trusted-build-or-launch-authority",
    "launchArgument": "--trusted-operational-scope developer-live",
    "developerHostOnly": true,
    "hostedOrCiSelectionAllowed": false,
    "ordinaryProductSettingAllowed": false,
    "environmentVariableSelectorAllowed": false,
    "providerSelectorAllowed": false,
    "artifactOrPluginSelectorAllowed": false,
    "crossScopeFallbackAllowed": false,
    "selectionConfiguresProvider": false,
    "selectionDispatchesRun": false
  },
  "decision": {
    "default": "deny",
    "providerAllowRules": [
      {
        "ruleId": "developer-live-public-samplebook-analysis",
        "policyResult": "eligible-only",
        "purpose": "developer-live-prompt-and-pipeline-tuning",
        "authorityOrigin": {
          "newlyUserInitiatedTaskRequired": true,
          "directRunAuthorizationAllowed": true,
          "matchingActiveDefaultExecutionRuleAllowed": false,
          "backgroundAnalysisEnrollmentAllowed": false,
          "idleScheduledImportTriggeredOrCrossRunDispatchAllowed": false
        },
        "executionMode": {
          "humanAttended": true,
          "developerHostOnly": true,
          "ciAllowed": false,
          "hostedAllowed": false,
          "scheduledAllowed": false,
          "backgroundAllowed": false
        },
        "source": {
          "admittedInputs": "owner-designated-public-samplebooks-under-adr-0043",
          "transmittableSetFixedByImplementingSlice": true,
          "privateManuscriptAllowed": false,
          "otherBookRefusedBeforeDispatch": true
        },
        "allowedOutboundDataCategories": [
          "public-or-synthetic"
        ],
        "redaction": {
          "housePeopleNamesAndRolesStripped": true,
          "remarksAndInternalNotesStripped": true,
          "authorInformationAllowed": true,
          "houseNameAllowed": true
        },
        "providerBinding": {
          "modelRole": "Main Editorial Role",
          "route": "opencode-go",
          "endpoint": "https://opencode.ai/zen/go/v1/chat/completions",
          "model": "deepseek-v4-flash",
          "credentialSlot": "opencode-go",
          "exactProviderBindingRequired": true,
          "fallbackAllowed": false,
          "approvedFallbackChainMaximumItems": 0,
          "secondModelAllowed": false,
          "productionDefaultsChanged": false
        },
        "transmissions": {
          "boundedByCoverageManifestUnitCount": true,
          "plusDeclaredSafeRetryAdaptations": true,
          "plusCrossUnitReductionTopicSections": true,
          "plusAssuranceSampleAnchorUnits": true,
          "plusOneRunReportReflectionTurn": true,
          "oneTechnicalSessionPerAnalysisUnit": true,
          "accumulatingSingleSessionAllowed": false,
          "identicalRequestReplaysFromProviderResultCache": true,
          "repeatedTestItemIdentifierAllowed": false,
          "crossUnitReductionAllowed": true,
          "assuranceSamplingAllowed": true,
          "runReportReflectionAllowed": true,
          "webSearchToolAllowed": true
        },
        "platformTools": {
          "websearch": {
            "service": "parallel",
            "host": "search.parallel.ai",
            "tool": "web_search",
            "anonymous": true
          },
          "webfetch": {
            "maxBytes": 5242880,
            "timeoutSeconds": 30,
            "boundedByCitations": true
          }
        },
        "authorizationPreconditions": {
          "eligibleConfiguredProviderRequired": true,
          "providerPreflightRequired": true,
          "exactProviderBindingRequired": true,
          "planEnvelopeRequired": true,
          "runAuthorizationRequired": true,
          "runSourceScopeRequired": true,
          "declaredOperationClassesRequired": true,
          "exactRunBudgetCeilingStateRequired": true,
          "unsetRunBudgetCeilingAllowed": false,
          "defaultRunBudgetCeilingTokensPerFrozenUnit": 90000,
          "defaultRunBudgetCeilingComputedAfterCoverageManifestFreeze": true,
          "ceilingEvaluatedBeforeEveryDispatch": true,
          "finalProviderPayloadEgressGateRequired": true,
          "frozenBeforeTransmission": true
        },
        "providerAccountLimit": {
          "classification": "quota-exhausted",
          "endsRunAsProviderAccountLimit": true,
          "retryAllowed": false,
          "fallbackAllowed": false,
          "secondModelAllowed": false
        },
        "capture": {
          "fixtureEmissionAllowed": false,
          "uploadAllowed": false,
          "providerResultCacheAllowed": true,
          "cacheLocation": "protected-local-staging-outside-every-checkout",
          "rawBytesInLogsDiagnosticsOrRepositoryAllowed": false,
          "repositoryEntryOnlyThroughReviewedFixtureGeneration": true
        },
        "additionalPrivacyPrompts": {
          "perBookRequired": false,
          "firstUseRequired": false,
          "perCallRequired": false,
          "perChunkRequired": false
        }
      },
      {
        "ruleId": "developer-live-editor-selected-excerpt-dialogue",
        "policyResult": "eligible-only",
        "purpose": "developer-live-interactive-editorial-dialogue",
        "authorityOrigin": {
          "editorStartedForegroundAttemptRequired": true,
          "exactSelectionAndQuestionAreTheAuthority": true,
          "newlyUserInitiatedTaskRequired": false,
          "directRunAuthorizationRequired": false,
          "matchingActiveDefaultExecutionRuleAllowed": false,
          "backgroundAnalysisEnrollmentAllowed": false,
          "idleScheduledImportTriggeredOrCrossRunDispatchAllowed": false
        },
        "executionMode": {
          "humanAttended": true,
          "developerHostOnly": true,
          "ciAllowed": false,
          "hostedAllowed": false,
          "scheduledAllowed": false,
          "backgroundAllowed": false
        },
        "source": {
          "admittedInputs": "owner-designated-public-samplebooks-under-adr-0043",
          "transmittableSetFixedByImplementingSlice": true,
          "editedRevisionsOfAdmittedBookAllowed": true,
          "privateManuscriptAllowed": false,
          "otherBookRefusedBeforeDispatch": true
        },
        "allowedOutboundDataCategories": [
          "editor-selected-manuscript-excerpt"
        ],
        "redaction": {
          "housePeopleNamesAndRolesStripped": true,
          "remarksAndInternalNotesStripped": true,
          "authorInformationAllowed": true,
          "houseNameAllowed": true
        },
        "providerBinding": {
          "modelRole": "Main Editorial Role",
          "route": "opencode-go",
          "endpoint": "https://opencode.ai/zen/go/v1/chat/completions",
          "model": "deepseek-v4-flash",
          "credentialSlot": "opencode-go",
          "exactProviderBindingRequired": true,
          "fallbackAllowed": false,
          "approvedFallbackChainMaximumItems": 0,
          "secondModelAllowed": false,
          "productionDefaultsChanged": false
        },
        "transmissions": {
          "attemptKinds": [
            "ask",
            "continue",
            "regenerate"
          ],
          "oneTransmissionPerAttempt": true,
          "oneTechnicalSessionPerAttempt": true,
          "retryResendOrContinuationWithinSessionAllowed": false,
          "continueAndRegenerateAreNewAttempts": true,
          "payload": [
            "frozen-editorial-dialogue-contract-header",
            "exact-selected-words",
            "question",
            "complete-kept-fragments-on-continue"
          ],
          "identicalRequestReplaysFromProviderResultCache": true,
          "repeatedTestItemIdentifierAllowed": false,
          "webSearchToolAllowed": false
        },
        "authorizationPreconditions": {
          "eligibleConfiguredProviderRequired": true,
          "providerPreflightRequired": true,
          "exactProviderBindingRequired": true,
          "planEnvelopeRequired": false,
          "runAuthorizationRequired": false,
          "runBudgetCeilingApplies": false,
          "costBound": "one-bounded-payload-per-attempt",
          "perAttemptOutputCapTokens": null,
          "finalProviderPayloadEgressGateRequired": true,
          "frozenBeforeTransmission": true
        },